<?xml version="1.0" encoding="UTF-8"?>
<sa:dokument xmlns:ns1="http://ftn.uns.ac.rs/interesovanje"
 xmlns:ns2="http://ftn.uns.ac.rs/potvrda_o_vakcinaciji"
 xmlns:sa="http://ftn.uns.ac.rs/saglasnost"
 xmlns:xsi="http://www.w3.org/2001/XMLSchema-instance"
 xsi:schemaLocation="http://ftn.uns.ac.rs/saglasnost file:/media/user/games/Projects/XML/demo/src/main/resources/schemas/saglasnost.xsd">
    <sa:saglasnost_za_sprovodjenje_imunizacije>
        <sa:drzavljanstvo>
            <sa:republika_srbija>
                <sa:jmbg>0000000000000</sa:jmbg>
            </sa:republika_srbija>
        </sa:drzavljanstvo>
        <sa:osoba>
            <sa:ime>ime0</sa:ime>
            <sa:prezime>prezime0</sa:prezime>
            <sa:ime_roditelja>ime_roditelja0</sa:ime_roditelja>
            <sa:pol>
                <sa:Musko>Musko</sa:Musko>
            </sa:pol>
            <sa:datum_rodjenja>2006-05-04</sa:datum_rodjenja>
            <sa:mesto_rodjenja>mesto_rodjenja0</sa:mesto_rodjenja>
            <sa:adresa>^A$</sa:adresa>
            <sa:mesto>mesto0</sa:mesto>
            <sa:mobilni>0600000000</sa:mobilni>
            <sa:fiksni>010000000</sa:fiksni>
            <sa:e-adresa>/^!@!.!$/</sa:e-adresa>
        </sa:osoba>
        <sa:radni_status>
            <sa:student>student</sa:student>
        </sa:radni_status>
        <sa:zanimanje>
            <sa:drugo>drugo</sa:drugo>
        </sa:zanimanje>
        <sa:korisnik_ustanove_soc_zastite izabran="false"/>
        <sa:izjava>
            <sa:saglasnost izabran="false"/>
            <sa:vakcina>
                <sa:Sinopharm>Sinopharm</sa:Sinopharm>
            </sa:vakcina>
        </sa:izjava>
        <sa:potpis>potpis0</sa:potpis>
        <sa:datum>2006-05-04</sa:datum>
    </sa:saglasnost_za_sprovodjenje_imunizacije>
    <sa:evidencija_o_vakcinaciji>
        <sa:zdravstvena_ustanova>zdravstvena_ustanova0</sa:zdravstvena_ustanova>
        <sa:vakcinacijski_punkt>vakcinacijski_punkt0</sa:vakcinacijski_punkt>
        <sa:ime_prezime_faksimil_brtel>
            <sa:ime>ime1</sa:ime>
            <sa:prezime>prezime1</sa:prezime>
            <sa:faksimil>0</sa:faksimil>
            <sa:brtel>0000000000</sa:brtel>
        </sa:ime_prezime_faksimil_brtel>
        <sa:tabela>
            <sa:element>
                <sa:vakcina>
                    <sa:Pfizer>Pfizer</sa:Pfizer>
                </sa:vakcina>
                <sa:datum_davanja>2006-05-04</sa:datum_davanja>
                <sa:nacin_davanja>IM</sa:nacin_davanja>
                <sa:ekstremitet>
                    <sa:lv>DR</sa:lv>
                </sa:ekstremitet>
                <sa:serija>-1073741773</sa:serija>
                <sa:proizvodjac>
                    <sa:Sinopharm>Sinopharm</sa:Sinopharm>
                </sa:proizvodjac>
                <sa:nezeljena_reakcija>false</sa:nezeljena_reakcija>
                <sa:potpis_lekara>potpis_lekara0</sa:potpis_lekara>
            </sa:element>
            <sa:element>
                <sa:vakcina>
                    <sa:Sputnik>Sputnik</sa:Sputnik>
                </sa:vakcina>
                <sa:datum_davanja>2006-05-04</sa:datum_davanja>
                <sa:nacin_davanja>IM</sa:nacin_davanja>
                <sa:ekstremitet>
                    <sa:lv>DR</sa:lv>
                </sa:ekstremitet>
                <sa:serija>-1073741773</sa:serija>
                <sa:proizvodjac>
                    <sa:Sinopharm>Sinopharm</sa:Sinopharm>
                </sa:proizvodjac>
                <sa:nezeljena_reakcija>false</sa:nezeljena_reakcija>
                <sa:potpis_lekara>potpis_lekara1</sa:potpis_lekara>
            </sa:element>
            <sa:privremene_kontradikcije>
                <sa:datum>2006-05-04</sa:datum>
                <sa:dijagnoza>dijagnoza0</sa:dijagnoza>
            </sa:privremene_kontradikcije>
            <sa:trajne_kontradikcije izabran="false"/>
        </sa:tabela>
    </sa:evidencija_o_vakcinaciji>
</sa:dokument>
